{
  "id": "flowlance:task:task-1",
  "action_type": "task",
  "title": "Qualify CRM opportunity",
  "description": "Confirm scope, budget, decision process and timeline",
  "owner": [
    "flowlance:user:user-1"
  ],
  "subject": [
    "flowlance:client:client-1"
  ],
  "due_at": "2026-09-04",
  "completed_at": null,
  "status": "open",
  "priority": "high",
  "related_commitment": null,
  "provenance": {
    "source_type": "application",
    "source_id": "flowlance:task:task-1",
    "created_by": {
      "type": "system",
      "id": "flowlance"
    },
    "method": "recorded",
    "assertion_type": "fact",
    "confidence": "high",
    "created_at": "2026-08-30T10:00:00.000Z",
    "derived_from": [],
    "extensions": {}
  },
  "extensions": {
    "flowlance.project_id": "project-1",
    "flowlance.client_id": "client-1",
    "flowlance.parent_task_id": null,
    "flowlance.estimated_hours": "2",
    "flowlance.updated_at": "2026-08-31T10:00:00.000Z"
  }
}
